{
  "schema_version": "1.0.0",
  "id": "django-django-13513",
  "title": "debug error view doesn't respect exc.__suppress_context__ (PEP 415)",
  "bug_trigger": "A patch changes django/views/debug.py near def _get_lines_from_file(self, filename, lineno, context_lines, loader=None, mod back toward the historical deleted structure.",
  "observed_failure": "SWE-bench Verified records 1 fail-to-pass test(s): test_innermost_exception_without_traceback (view_tests.tests.test_debug.ExceptionReporterTests)",
  "affected_symbols": [
    {
      "path": "django/views/debug.py",
      "symbol": "def _get_lines_from_file(self, filename, lineno, context_lines, loader=None, mod",
      "language": "python"
    }
  ],
  "buggy_pattern": {
    "code": "def get_traceback_frames(self):",
    "kind": "historical_deleted_line",
    "calls": []
  },
  "fixed_pattern": {
    "code": "def _get_explicit_or_implicit_cause(self, exc_value):",
    "kind": "historical_added_line",
    "calls": []
  },
  "invariant": "Preserve the fixed structural form at this evidenced path/symbol unless the linked regression tests and applicability are deliberately superseded.",
  "reproducer": {
    "capsule_id": "",
    "status": "heuristic",
    "scope": "structural patch replay; upstream behavior externally reported"
  },
  "regression_tests": [
    {
      "path": "tests/view_tests/tests/test_debug.py",
      "name": "test_innermost_exception_without_traceback (view_tests.tests.test_debug.ExceptionReporterTests)",
      "framework": "pytest"
    }
  ],
  "applicability": {
    "paths": [
      "django/views/debug.py"
    ],
    "symbols": [
      "def _get_lines_from_file(self, filename, lineno, context_lines, loader=None, mod"
    ],
    "languages": [
      "python"
    ],
    "category": "null"
  },
  "evidence": [
    {
      "type": "swe_bench_verified",
      "url": "https://huggingface.co/datasets/SWE-bench/SWE-bench_Verified",
      "observed_at": "2026-08-20T13:22:10Z"
    },
    {
      "type": "pull_request",
      "url": "https://github.com/django/django/pull/13513",
      "sha": "78ae8cc5d8aff65afbf35947421a8a1aba13bfab",
      "observed_at": "2026-08-20T13:22:10Z"
    },
    {
      "type": "base_commit",
      "url": "https://github.com/django/django/commit/6599608c4d0befdcb820ddccce55f183f247ae4f",
      "sha": "6599608c4d0befdcb820ddccce55f183f247ae4f",
      "observed_at": "2026-08-20T13:22:10Z"
    }
  ],
  "confidence": {
    "score": 0.9,
    "classification": "externally_reported",
    "rationale": "Human-filtered benchmark record, merged PR, production patch, test patch and fail-to-pass test names are present; upstream tests were not run locally."
  },
  "limitations": [
    "Invariant wording is conservative and mechanically generated from the patch, not a semantic human annotation.",
    "The upstream environment was not executed locally.",
    "The optional capsule checks structural patch identity only."
  ],
  "source_commit": "6599608c4d0befdcb820ddccce55f183f247ae4f",
  "fixed_commit": "78ae8cc5d8aff65afbf35947421a8a1aba13bfab",
  "repository": "django/django",
  "license": {
    "spdx": "BSD-3-Clause",
    "source": "https://github.com/django/django/blob/main/LICENSE"
  },
  "timestamps": {
    "reported": "2020-10-08T14:07:33Z",
    "mined": "2026-08-20T13:22:10Z"
  },
  "content_hash": "sha256:1c85c4cad3cfafe601e0ee62adec04854350a38acb1596041bf57d0f1071fb69"
}
