{
  "schema_version": "1.0.0",
  "id": "django-django-13658",
  "title": "ManagementUtility instantiates CommandParser without passing already-computed prog argument",
  "bug_trigger": "A patch changes django/core/management/__init__.py near def execute(self): back toward the historical deleted structure.",
  "observed_failure": "SWE-bench Verified records 1 fail-to-pass test(s): test_program_name_from_argv (admin_scripts.tests.ExecuteFromCommandLine)",
  "affected_symbols": [
    {
      "path": "django/core/management/__init__.py",
      "symbol": "def execute(self):",
      "language": "python"
    }
  ],
  "buggy_pattern": {
    "code": "parser = CommandParser(usage='%(prog)s subcommand [options] [args]', add_help=False, allow_abbrev=False)",
    "kind": "historical_deleted_line",
    "calls": []
  },
  "fixed_pattern": {
    "code": "parser = CommandParser(",
    "kind": "historical_added_line",
    "calls": []
  },
  "invariant": "Preserve the fixed structural form at this evidenced path/symbol unless the linked regression tests and applicability are deliberately superseded.",
  "reproducer": {
    "capsule_id": "",
    "status": "heuristic",
    "scope": "structural patch replay; upstream behavior externally reported"
  },
  "regression_tests": [
    {
      "path": "tests/admin_scripts/tests.py",
      "name": "test_program_name_from_argv (admin_scripts.tests.ExecuteFromCommandLine)",
      "framework": "pytest"
    }
  ],
  "applicability": {
    "paths": [
      "django/core/management/__init__.py"
    ],
    "symbols": [
      "def execute(self):"
    ],
    "languages": [
      "python"
    ],
    "category": "null"
  },
  "evidence": [
    {
      "type": "swe_bench_verified",
      "url": "https://huggingface.co/datasets/SWE-bench/SWE-bench_Verified",
      "observed_at": "2026-08-20T13:22:10Z"
    },
    {
      "type": "pull_request",
      "url": "https://github.com/django/django/pull/13658",
      "sha": "cc2269350548307e3fe31723ff4e40a879a7a173",
      "observed_at": "2026-08-20T13:22:10Z"
    },
    {
      "type": "base_commit",
      "url": "https://github.com/django/django/commit/0773837e15bb632afffb6848a58c59a791008fa1",
      "sha": "0773837e15bb632afffb6848a58c59a791008fa1",
      "observed_at": "2026-08-20T13:22:10Z"
    }
  ],
  "confidence": {
    "score": 0.9,
    "classification": "externally_reported",
    "rationale": "Human-filtered benchmark record, merged PR, production patch, test patch and fail-to-pass test names are present; upstream tests were not run locally."
  },
  "limitations": [
    "Invariant wording is conservative and mechanically generated from the patch, not a semantic human annotation.",
    "The upstream environment was not executed locally.",
    "The optional capsule checks structural patch identity only."
  ],
  "source_commit": "0773837e15bb632afffb6848a58c59a791008fa1",
  "fixed_commit": "cc2269350548307e3fe31723ff4e40a879a7a173",
  "repository": "django/django",
  "license": {
    "spdx": "BSD-3-Clause",
    "source": "https://github.com/django/django/blob/main/LICENSE"
  },
  "timestamps": {
    "reported": "2020-11-09T20:50:28Z",
    "mined": "2026-08-20T13:22:10Z"
  },
  "content_hash": "sha256:4ddc083f739752b1aeabfda6fad606a8c4c7c031e4859eb7c0c6615ca8763776"
}
