{
  "schema_version": "1.0.0",
  "id": "astropy-astropy-7166",
  "title": "InheritDocstrings metaclass doesn't work for properties",
  "bug_trigger": "A patch changes astropy/utils/misc.py near def is_public_member(key): back toward the historical deleted structure.",
  "observed_failure": "SWE-bench Verified records 1 fail-to-pass test(s): astropy/utils/tests/test_misc.py::test_inherit_docstrings",
  "affected_symbols": [
    {
      "path": "astropy/utils/misc.py",
      "symbol": "def is_public_member(key):",
      "language": "python"
    }
  ],
  "buggy_pattern": {
    "code": "if (inspect.isfunction(val) and",
    "kind": "historical_deleted_line",
    "calls": []
  },
  "fixed_pattern": {
    "code": "if ((inspect.isfunction(val) or inspect.isdatadescriptor(val)) and",
    "kind": "historical_added_line",
    "calls": []
  },
  "invariant": "Preserve the fixed structural form at this evidenced path/symbol unless the linked regression tests and applicability are deliberately superseded.",
  "reproducer": {
    "capsule_id": "astropy-astropy-7166",
    "status": "heuristic",
    "scope": "structural patch replay; upstream behavior externally reported"
  },
  "regression_tests": [
    {
      "path": "astropy/utils/tests/test_misc.py",
      "name": "astropy/utils/tests/test_misc.py::test_inherit_docstrings",
      "framework": "pytest"
    }
  ],
  "applicability": {
    "paths": [
      "astropy/utils/misc.py"
    ],
    "symbols": [
      "def is_public_member(key):"
    ],
    "languages": [
      "python"
    ],
    "category": "other"
  },
  "evidence": [
    {
      "type": "swe_bench_verified",
      "url": "https://huggingface.co/datasets/SWE-bench/SWE-bench_Verified",
      "observed_at": "2026-08-20T13:22:10Z"
    },
    {
      "type": "pull_request",
      "url": "https://github.com/astropy/astropy/pull/7166",
      "sha": "61d6a98da287acc7289f7b4cd8c50dc6056317c9",
      "observed_at": "2026-08-20T13:22:10Z"
    },
    {
      "type": "base_commit",
      "url": "https://github.com/astropy/astropy/commit/26d147868f8a891a6009a25cd6a8576d2e1bd747",
      "sha": "26d147868f8a891a6009a25cd6a8576d2e1bd747",
      "observed_at": "2026-08-20T13:22:10Z"
    }
  ],
  "confidence": {
    "score": 0.9,
    "classification": "externally_reported",
    "rationale": "Human-filtered benchmark record, merged PR, production patch, test patch and fail-to-pass test names are present; upstream tests were not run locally."
  },
  "limitations": [
    "Invariant wording is conservative and mechanically generated from the patch, not a semantic human annotation.",
    "The upstream environment was not executed locally.",
    "The optional capsule checks structural patch identity only."
  ],
  "source_commit": "26d147868f8a891a6009a25cd6a8576d2e1bd747",
  "fixed_commit": "61d6a98da287acc7289f7b4cd8c50dc6056317c9",
  "repository": "astropy/astropy",
  "license": {
    "spdx": "BSD-3-Clause",
    "source": "https://github.com/astropy/astropy/blob/main/LICENSE.rst"
  },
  "timestamps": {
    "reported": "2018-02-07T15:05:31Z",
    "mined": "2026-08-20T13:22:10Z"
  },
  "content_hash": "sha256:ef15e8637a96dd27232ecb3dfb32af394024004774b2bd00a002b895d8f17be2"
}
