{
  "schema_version": "1.0.0",
  "id": "django-django-11999",
  "title": "Cannot override get_FOO_display() in Django 2.2+.",
  "bug_trigger": "A patch changes django/db/models/fields/__init__.py near def contribute_to_class(self, cls, name, private_only=False): back toward the historical deleted structure.",
  "observed_failure": "SWE-bench Verified records 1 fail-to-pass test(s): test_overriding_FIELD_display (model_fields.tests.GetFieldDisplayTests)",
  "affected_symbols": [
    {
      "path": "django/db/models/fields/__init__.py",
      "symbol": "def contribute_to_class(self, cls, name, private_only=False):",
      "language": "python"
    }
  ],
  "buggy_pattern": {
    "code": "setattr(cls, 'get_%s_display' % self.name,",
    "kind": "historical_deleted_line",
    "calls": []
  },
  "fixed_pattern": {
    "code": "if not hasattr(cls, 'get_%s_display' % self.name):",
    "kind": "historical_added_line",
    "calls": []
  },
  "invariant": "Preserve the fixed structural form at this evidenced path/symbol unless the linked regression tests and applicability are deliberately superseded.",
  "reproducer": {
    "capsule_id": "",
    "status": "heuristic",
    "scope": "structural patch replay; upstream behavior externally reported"
  },
  "regression_tests": [
    {
      "path": "tests/model_fields/tests.py",
      "name": "test_overriding_FIELD_display (model_fields.tests.GetFieldDisplayTests)",
      "framework": "pytest"
    }
  ],
  "applicability": {
    "paths": [
      "django/db/models/fields/__init__.py"
    ],
    "symbols": [
      "def contribute_to_class(self, cls, name, private_only=False):"
    ],
    "languages": [
      "python"
    ],
    "category": "other"
  },
  "evidence": [
    {
      "type": "swe_bench_verified",
      "url": "https://huggingface.co/datasets/SWE-bench/SWE-bench_Verified",
      "observed_at": "2026-08-20T13:22:10Z"
    },
    {
      "type": "pull_request",
      "url": "https://github.com/django/django/pull/11999",
      "sha": "2d38eb0ab9f78d68c083a5b78b1eca39027b279a",
      "observed_at": "2026-08-20T13:22:10Z"
    },
    {
      "type": "base_commit",
      "url": "https://github.com/django/django/commit/84633905273fc916e3d17883810d9969c03f73c2",
      "sha": "84633905273fc916e3d17883810d9969c03f73c2",
      "observed_at": "2026-08-20T13:22:10Z"
    }
  ],
  "confidence": {
    "score": 0.9,
    "classification": "externally_reported",
    "rationale": "Human-filtered benchmark record, merged PR, production patch, test patch and fail-to-pass test names are present; upstream tests were not run locally."
  },
  "limitations": [
    "Invariant wording is conservative and mechanically generated from the patch, not a semantic human annotation.",
    "The upstream environment was not executed locally.",
    "The optional capsule checks structural patch identity only."
  ],
  "source_commit": "84633905273fc916e3d17883810d9969c03f73c2",
  "fixed_commit": "2d38eb0ab9f78d68c083a5b78b1eca39027b279a",
  "repository": "django/django",
  "license": {
    "spdx": "BSD-3-Clause",
    "source": "https://github.com/django/django/blob/main/LICENSE"
  },
  "timestamps": {
    "reported": "2019-10-31T10:39:18Z",
    "mined": "2026-08-20T13:22:10Z"
  },
  "content_hash": "sha256:d24cd4da12c212c479aa6a84a531fc3e9657e0fe34e9bc5bce150eccca251651"
}
