{
  "schema_version": "1.0.0",
  "id": "astropy-astropy-14508",
  "title": "`io.fits.Card` may use a string representation of floats that is larger than necessary",
  "bug_trigger": "A patch changes astropy/io/fits/card.py near def _format_value(value): back toward the historical deleted structure.",
  "observed_failure": "SWE-bench Verified records 1 fail-to-pass test(s): astropy/io/fits/tests/test_header.py::TestHeaderFunctions::test_floating_point_string_representation_card",
  "affected_symbols": [
    {
      "path": "astropy/io/fits/card.py",
      "symbol": "def _format_value(value):",
      "language": "python"
    }
  ],
  "buggy_pattern": {
    "code": "\"\"\"Format a floating number to make sure it gets the decimal point.\"\"\"",
    "kind": "historical_deleted_line",
    "calls": []
  },
  "fixed_pattern": {
    "code": "\"\"\"Format a floating number to make sure it is at most 20 characters.\"\"\"",
    "kind": "historical_added_line",
    "calls": []
  },
  "invariant": "Preserve the fixed structural form at this evidenced path/symbol unless the linked regression tests and applicability are deliberately superseded.",
  "reproducer": {
    "capsule_id": "astropy-astropy-14508",
    "status": "heuristic",
    "scope": "structural patch replay; upstream behavior externally reported"
  },
  "regression_tests": [
    {
      "path": "astropy/io/fits/tests/test_header.py",
      "name": "astropy/io/fits/tests/test_header.py::TestHeaderFunctions::test_floating_point_string_representation_card",
      "framework": "pytest"
    }
  ],
  "applicability": {
    "paths": [
      "astropy/io/fits/card.py"
    ],
    "symbols": [
      "def _format_value(value):"
    ],
    "languages": [
      "python"
    ],
    "category": "other"
  },
  "evidence": [
    {
      "type": "swe_bench_verified",
      "url": "https://huggingface.co/datasets/SWE-bench/SWE-bench_Verified",
      "observed_at": "2026-08-20T13:22:10Z"
    },
    {
      "type": "pull_request",
      "url": "https://github.com/astropy/astropy/pull/14508",
      "sha": "386b52e980c8fa17e8838bb02a2cf60976f9db73",
      "observed_at": "2026-08-20T13:22:10Z"
    },
    {
      "type": "base_commit",
      "url": "https://github.com/astropy/astropy/commit/a3f4ae6cd24d5ecdf49f213d77b3513dd509a06c",
      "sha": "a3f4ae6cd24d5ecdf49f213d77b3513dd509a06c",
      "observed_at": "2026-08-20T13:22:10Z"
    }
  ],
  "confidence": {
    "score": 0.9,
    "classification": "externally_reported",
    "rationale": "Human-filtered benchmark record, merged PR, production patch, test patch and fail-to-pass test names are present; upstream tests were not run locally."
  },
  "limitations": [
    "Invariant wording is conservative and mechanically generated from the patch, not a semantic human annotation.",
    "The upstream environment was not executed locally.",
    "The optional capsule checks structural patch identity only."
  ],
  "source_commit": "a3f4ae6cd24d5ecdf49f213d77b3513dd509a06c",
  "fixed_commit": "386b52e980c8fa17e8838bb02a2cf60976f9db73",
  "repository": "astropy/astropy",
  "license": {
    "spdx": "BSD-3-Clause",
    "source": "https://github.com/astropy/astropy/blob/main/LICENSE.rst"
  },
  "timestamps": {
    "reported": "2023-03-09T11:08:51Z",
    "mined": "2026-08-20T13:22:10Z"
  },
  "content_hash": "sha256:fdc1cae126cf9c9e7b11981f0364b4300af29c72242e9f86349d2ef7494b4e4a"
}
